Disease,Description
Otitis Media,An infection or inflammation of the middle ear  often causing pain fever  and hearing difficulties  commonly seen in children.
Otitis Externa,"An infection of the outer ear canal  often due to water exposure leading to itching ,pain and discharge."
Sinusitis,Inflammation or infection of the sinuses  causing nasal congestion  facial pain  and thick nasal discharge.
Allergic Rhinitis,An allergic reaction affecting the nasal passages  triggered by allergens like pollen  causing sneezing  runny nose  and itchy eyes.
Tonsillitis,Inflammation of the tonsils  usually due to bacterial or viral infection leading to sore throat and difficulty swallowing.
Laryngitis,Inflammation of the larynx often causing hoarseness or loss of voice typically due to viral infection or vocal strain.
Menieres Disease,A disorder of the inner ear causing vertigo tinnitus hearing loss and a feeling of fullness in the ear.
Deviated Septum,A condition where the nasal septum is misaligned leading to breathing difficulties and recurrent sinus infections.
Tinnitus,Perception of noise or ringing in the ears without an external source often linked to hearing loss or ear injury.
Epistaxis,Nosebleeds caused by irritation  or dry air affecting the nasal mucosa often recurring in dry climates.
